{
  "name": "アポロ 7 号",
  "type": "有人地球周回 · 飛行済み",
  "first": "最初の有人アポロ飛行 — 地球周回軌道での CSM 検証",
  "description": "アポロ 1 号火災 (1967 年 1 月 27 日) で Grissom、White、Chaffee が射場で命を落としてから 21 か月後の最初の有人アポロ飛行。アポロ 7 は再設計された Block II 司令船・機械船を地球周回軌道で検証 — 生命維持、電力、推進 (SPS を 8 回点火)、熱制御、そして有人米国宇宙船からの世界初の生中継 TV 放送。10 日 20 時間の飛行で 2 か月後のアポロ 8 号の月周回軌道への挑戦への道を開いた。",
  "events": [
    {
      "met": 0,
      "label": "LAUNCH",
      "note": "Saturn IB (AS-205) from Cape Kennedy LC-34 1968-10-11 15:02 UTC.",
      "type": "nominal"
    },
    {
      "met": 0.1,
      "label": "ORBIT INSERT",
      "note": "CSM separates from S-IVB into 232 × 285 km Earth orbit, inclination 31.6°. SPS firing sequence (8 burns over 11 days) validates the propulsion that will perform LOI + TEI at the Moon.",
      "type": "nominal"
    },
    {
      "met": 1.2,
      "label": "FIRST LIVE TV",
      "note": "\"Hello from the lovely Apollo room high atop everything.\" First live TV broadcast from a crewed US spacecraft.",
      "type": "info"
    },
    {
      "met": 10.8,
      "label": "SPLASHDOWN",
      "note": "CM splashed down in the North Atlantic 1968-10-22 11:11 UTC after 163 orbits / 7.4 million km / 10 d 20 h. Recovery by USS Essex.",
      "type": "nominal"
    }
  ]
}
