{
  "name": "Цхандраиаан-3",
  "type": "ЛАНДЕР · РОВЕР · ФЛОВН",
  "first": "Прво меко слетање близу јужног пола Месеца",
  "description": "Након губитка Цхандраиаан-2-овог Викрам лендера 2019. године, трећа лунарна мисија __АЦР0__ била је намерно конзервативна - фокусирана на лендер, а не на ношење орбитера. Викрам је долетео на 69,4° Ј географске ширине, најближе што је било која свемирска летелица дошла до Месечевог пола. Ровер Прагјан је први пут открио сумпор на површини Месеца и извршио термална мерења на лицу места. Индија је постала четврта нација која је меко слетела на Месец и прва у поларним регионима где ће се вероватно десити будуће рударење воденог леда.",
  "events": [
    {
      "met": 0,
      "label": "ЛАУНЦХ",
      "note": "ЛВМ3 М4 (раније ГСЛВ Мк ИИИ) из Срихарикоте.",
      "type": "nominal"
    },
    {
      "met": 22,
      "label": "МОИ",
      "note": "Убацивање у лунарну орбиту (коришћено је вишеструке опекотине на Земљи и лунарној орбити).",
      "type": "nominal"
    },
    {
      "met": 38,
      "label": "ЛАНДЕР СЕПАРАТИОН",
      "note": "Викрам лендер се одваја од погонског модула.",
      "type": "nominal"
    },
    {
      "met": 40,
      "label": "ТОУЦХДОВН",
      "note": "Викрам слеће на Схив Схакти Поинт близу јужног пола 2023-08-23 12:33 УТЦ.",
      "type": "nominal"
    },
    {
      "met": 40.5,
      "label": "ПРАГИАН РАСПОРЕЂЕН",
      "note": "Ровер се котрља низ рампу; почиње наука о површини.",
      "type": "info"
    },
    {
      "met": 53,
      "label": "ЛУНАРНА НОЋ",
      "note": "Лендер/ровер стављен у хибернацију када почне лунарна ноћ.",
      "type": "info"
    }
  ]
}
