{
  "name": "MMX",
  "type": "إعادة عينات من فوبوس · مخطط",
  "first": "أول إعادة عينات من قمر مريخي",
  "description": "استكشاف أقمار المريخ يخطط جاكسا للهبوط على فوبوس، وحفر ~10 غ من الريغوليث، وإعادتها. قد تحسم العينات نقاشًا طويلًا: هل فوبوس ودييموس كويكبات ملتقطة، أم شظايا من اصطدام قديم على المريخ؟ المهمة تشمل أيضًا عربة ألمانية–فرنسية للحركة على فوبوس — نموذج تشغيل مختلف تمامًا عن هايابوسا في إيتوكاوا أو ريوغو. كان الإطلاق 2024 لكن تأخر إلى 2026 لتأخر H3.",
  "events": [
    { "met": 0, "label": "الإطلاق", "note": "H3-24L من تانيجاشيما — المُطلق الثقيل الجديد لجاكسا.", "type": "nominal" },
    { "met": 334, "label": "إدخال مدار المريخ", "note": "التقاط في مدار المريخ؛ نقل إلى شبه مدار فوبوس خلال الأشهر التالية.", "type": "nominal" },
    { "met": 600, "label": "نشر العربة", "note": "عربة DLR/CNES (~25 كغ) تُطلق على سطح فوبوس لدراسات موضعية.", "type": "info" },
    { "met": 1100, "label": "عينة فوبوس", "note": "MMX تهبط على فوبوس؛ يُجمع ~10 غ من الريغوليث.", "type": "info" },
    { "met": 1500, "label": "عودة إلى الأرض", "note": "كبسولة عينات تصل إلى الأرض ~2031.", "type": "info" }
  ]
}
