{
  "name": "嫦娥 5 号",
  "type": "試料帰還 · 飛行済み",
  "first": "四十四年ぶりの月試料帰還（一九七六年ルナ 24 以来）",
  "description": "嫦娥 5 号は一九七六年ソ連のルナ 24 以来初の月試料帰還 — 四十四年の空白。構成：軌道機＋着陸機＋上昇機＋試料返還カプセルを一打ち上げ。着陸機はリュムケ山に着陸しドリルとすくいで一・七三一キログラムのレゴリスを採取、離昇し軌道機とランデブウドック（初のロボット月ランデブウ）、カプセルが地球へ帰還。試料は二十億年しか経っていない地域由来 — Apollo や Luna 試料よりずっと若く、月の火山モデルを書き換えた。",
  "events": [
    { "met": 0, "label": "LAUNCH", "note": "文昌から長征五号。", "type": "nominal" },
    { "met": 5, "label": "MOI", "note": "月軌道投入。", "type": "nominal" },
    { "met": 8, "label": "TOUCHDOWN", "note": "着陸機がリュムケ山（嵐の大洋）へ下降 2020-12-01。", "type": "nominal" },
    { "met": 8.5, "label": "SAMPLING", "note": "すくいとドリルで一・七三一 kg 採取。", "type": "info" },
    { "met": 10, "label": "ASCENT", "note": "上昇機が月面から離昇。", "type": "nominal" },
    { "met": 11, "label": "RENDEZVOUS", "note": "初のロボット月ランデブウ；試料容器を軌道機へ移送。", "type": "info" },
    { "met": 23, "label": "EARTH RETURN", "note": "試料カプセルが内モンゴルに着陸 2020-12-16。", "type": "info" }
  ]
}
