{
  "name": "SLIM",
  "type": "ТОЧНЫЙ ПОСАДОЧНЫЙ МОДУЛЬ · АКТИВНЫЙ",
  "first": "Первая точная посадка в пределах 100 м от цели на другом мире",
  "description": "До SLIM лунные посадки были точны на километры. Smart Lander JAXA продемонстрировал точность ~100 м — как нужно для пилотируемых миссий со стыковкой к заранее доставленному грузу, для взлётных ступеней возврата образцов и любой архитектуры, где важна посадка в конкретную научную точку. SLIM также испробовал малозатратную баллистическую передачу на Луну: 135 суток полёта при меньшем расходе топлива, чем у прямых траекторий. Терпение, доступное межпланетным миссиям, когда время не главное ограничение.",
  "events": [
    { "met": 0, "label": "LAUNCH", "note": "H-IIA 202 с Танэгасимы 2023-09-06.", "type": "nominal" },
    { "met": 90, "label": "BALLISTIC TRANSFER", "note": "Идёт малозатратное баллистическое захватывание.", "type": "info" },
    { "met": 130, "label": "MOI", "note": "Выход на окололунную орбиту.", "type": "nominal" },
    { "met": 135, "label": "TOUCHDOWN", "note": "Мягкая посадка в кратер Сиоли 2024-01-19 15:20 UTC. В пределах цели: ~55 м от центра.", "type": "nominal" },
    { "met": 135.01, "label": "TILTED LANDING", "note": "Аппарат опирается носом из-за аномалии двигателя на финале; солнечные панели сначала в тени.", "type": "warning" },
    { "met": 144, "label": "POWER RESUMED", "note": "Угол Солнца изменился; панели генерируют энергию; работа возобновлена на одни лунные сутки.", "type": "info" }
  ]
}
