{
  "name": "अपोलो 13",
  "type": "यात्री फ्लाईबाई · उड़ान भरा (अवतरण रद्द)",
  "first": "वह मिशन जिसने लगभग आपदा को NASA की सबसे प्रसिद्ध बचाव गाथा में बदल दिया",
  "description": "अपोलो 13 तीसरा यात्री चंद्रमा-अवतरण होने वाला था, फ्रा माउरो उच्चभूमि लक्ष्य। उड़ान के 55 घंटे 54 मिनट पर सेवा मॉड्यूल में एक ऑक्सीजन टैंक फट गया, जिससे कमांड-सर्विस मॉड्यूल के विद्युत और जीवन-समर्थन तंत्र पंगु हो गए। अवतरण रद्द होने पर — जेम्स लोवेल, जैक स्वाइगर्ट और फ्रेड हाइस — ने CSM को बंद किया, चंद्र मॉड्यूल अक्वेरियस में जीवनरक्षक नाव की तरह स्थानांतरित हुए, और LM के अवरोहण इंजन का उपयोग कर पेरीसिंथियॉन+2-घंटे की दहन की, जिसने उन्हें त्वरित मुक्त-वापसी प्रक्षेपवक्र पर रखा। उन्होंने 1970-04-15 को 254 km ऊँचाई पर मारे कॉग्निटम के ऊपर से चंद्रमा को पार किया और 1970-04-17 को दक्षिणी प्रशांत में सुरक्षित जल-अवतरण किया। आज इस मिशन का अध्ययन वास्तविक-काल अनुशासित इंजीनियरिंग आशुरचना के मॉडल के रूप में किया जाता है।",
  "events": [
    { "met": 0, "label": "SATURN V LAUNCH", "note": "KSC LC-39A से प्रक्षेपण। S-II द्वितीय चरण का केंद्रीय इंजन दो मिनट पहले बंद हो गया — बाहरी इंजनों ने भरपाई की।", "type": "nominal" },
    { "met": 0.117, "label": "TLI", "note": "S-IVB द्वारा ट्रांस-लूनर इंजेक्शन बर्न; CSM + LM चंद्र प्रक्षेपवक्र पर प्रतिबद्ध होते हैं।", "type": "nominal" },
    { "met": 1.2, "label": "MCC-2", "note": "मध्य-पथ सुधार अंतरिक्ष यान को मुक्त-वापसी प्रक्षेपवक्र से हटाकर फ्रा माउरो अप्रोच पर स्थानांतरित करता है।", "type": "nominal" },
    { "met": 2.33, "label": "OXYGEN TANK #2 RUPTURE", "note": "SM क्रायो-स्टिर कमांड शॉर्ट-सर्किट और टैंक के फटने को आरंभ करता है। \"ह्यूस्टन, हमें एक समस्या आ गई है।\" शक्ति और जल कम होते हैं; LM अक्वेरियस जीवनरक्षक नाव बन जाता है।", "type": "warning" },
    { "met": 2.92, "label": "FREE-RETURN BURN", "note": "LM अवरोहण इंजन का 31-सेकंड बर्न अंतरिक्ष यान को मुक्त-वापसी प्रक्षेपवक्र पर लौटा देता है।", "type": "info" },
    { "met": 3.13, "label": "LUNAR FLYBY", "note": "मारे कॉग्निटम के ऊपर 254 km ऊँचाई पर निकटतम अप्रोच — पृथ्वी से किसी भी यात्री अंतरिक्ष यान द्वारा तय की गई सबसे दूर की यात्रा।", "type": "info" },
    { "met": 3.96, "label": "PC+2 BURN", "note": "पेरीसिंथियॉन-प्लस-2-घंटे का बर्न पृथ्वी पर वापसी का समय दस घंटे कम कर देता है।", "type": "nominal" },
    { "met": 5.95, "label": "SPLASHDOWN", "note": "CSM पुनः प्रवेश और दक्षिणी प्रशांत जल-अवतरण, USS Iwo Jima द्वारा बरामद।", "type": "info" }
  ]
}
