{
  "name": "베가 1호",
  "type": "플라이바이 + 착륙선 + 풍선 · 완료",
  "first": "다른 행성 대기에 배치된 최초의 풍선 기구(금성, 1985)",
  "description": "소비에트-ESA의 핼리 함대 임무. 베가 1호는 베네라 계열 착륙선과 ESA/CNES가 제작한 헬륨 풍선을 운반했으며, 풍선은 금성 대기 54 km 고도에서 46.5시간 떠다녔습니다. 하강 모듈을 분리한 후, 버스는 금성 중력 도움을 사용하여 핼리 혜성(1P)으로 재표적화, 1986-3-6 최근접(8890 km)을 달성 — 사상 최초의 혜성 핵 조우.",
  "events": [
    {
      "met": 0,
      "label": "발사",
      "note": "프로톤-K / D-1이 베가 1호를 바이코누르에서 발사.",
      "type": "nominal"
    },
    {
      "met": 178,
      "label": "금성 조우",
      "note": "하강 모듈 분리 + 착륙; 풍선이 54 km 고도에서 46.5시간 동안 전개.",
      "type": "nominal"
    },
    {
      "met": 446,
      "label": "핼리 플라이바이",
      "note": "핼리 혜성(1P)으로의 최근접 8890 km — 사상 최초의 혜성 핵 관측.",
      "type": "nominal"
    }
  ]
}
