{
  "name": "Chandrayaan-3",
  "type": "ПОСАДОЧНЫЙ МОДУЛЬ · РОВЕР · ОТРАБОТАНА",
  "first": "Первая мягкая посадка у южного полюса Луны",
  "description": "После потери посадочного модуля Vikram при Chandrayaan-2 в 2019 году третья миссия ISRO была сознательно осторожной — упор на посадочный модуль без тяжёлого орбитера. Vikram коснулся поверхности на широте 69,4° ю.ш. — ближе всего к полюсу из всех аппаратов. Ровер Pragyan впервые обнаружил серу на месте и провёл теплоизмерения. Индия стала четвёртой страной с мягкой посадкой и первой в полярных регионах, где вероятна добыча водяного льда.",
  "events": [
    { "met": 0, "label": "LAUNCH", "note": "LVM3 M4 (бывш. GSLV Mk III) со Шрихарикоты.", "type": "nominal" },
    { "met": 22, "label": "MOI", "note": "Выход на окололунную орбиту (серия разгонов земной и лунной орбиты).", "type": "nominal" },
    { "met": 38, "label": "LANDER SEPARATION", "note": "Посадочный модуль Vikram отделяется от разгонного блока.", "type": "nominal" },
    { "met": 40, "label": "TOUCHDOWN", "note": "Vikram садится в точке Shiv Shakti у южного полюса 2023-08-23 12:33 UTC.", "type": "nominal" },
    { "met": 40.5, "label": "PRAGYAN DEPLOYED", "note": "Ровер съезжает с рампы; начинается работа на поверхности.", "type": "info" },
    { "met": 53, "label": "LUNAR NIGHT", "note": "Посадочный модуль и ровер уходят в спячку с началом лунной ночи.", "type": "info" }
  ]
}
