{
  "name": "Vostok 6",
  "type": "BEMANNTER ERDORBIT · GEFLOGEN",
  "first": "Erste Frau im All — Walentina Tereschkowa, 48 Umläufe",
  "description": "Walentina Tereschkowas 48-Umlauf-Flug von 2 Tagen 23 Stunden — erste Frau im All und (bis Soyuz MS-22 im Jahr 2022) einzige Frau, die eine Solo-Raumflugmission geflogen hat. Aus einer 1962 zusammengestellten Gruppe von fünf weiblichen Kosmonautenkandidatinnen ausgewählt, startete Tereschkowa am 1963-06-16 um 09:30 UTC, nur 2 Jahre nach Gagarins erstem Orbitalflug. Ihre Kapsel war für ein aufwärts statt abwärts gerichtetes Bahnkorrekturmanöver programmiert — sie identifizierte den Fehler manuell, und die Bodencontroller spielten am nächsten Tag eine korrigierte Lageregelungssoftware hoch. Landung am 1963-06-19 um 08:20 UTC bei Bajewo, Region Altai. Tereschkowa wurde später eine führende Figur in der sowjetischen Politik und bleibt mit 26 Jahren die jüngste je in den Orbit geflogene Frau.",
  "events": [
    {
      "met": 0,
      "label": "LAUNCH",
      "note": "Vostok-K from Baikonur Site 1 1963-06-16 09:30 UTC.",
      "type": "nominal"
    },
    {
      "met": 0.5,
      "label": "ORBIT-CORRECTION ERROR",
      "note": "Pre-loaded attitude software would have raised orbit instead of lowering it; corrected next day.",
      "type": "warning"
    },
    {
      "met": 2.95,
      "label": "EJECT + LAND",
      "note": "Landed near Bayevo, Altai Krai, 1963-06-19 08:20 UTC after 48 orbits.",
      "type": "nominal"
    }
  ]
}
